<?xml version="1.0" encoding="UTF-8"?>

<canciones xmlns:xsi="http://www.w3.org/2001/XMLSchema-instance"
xsi:noNamespaceSchemaLocation="cancion.xsd">
<cancion duracion="4:47" anio="2008">

	<titulo>Give it 2 me</titulo>
	<compositores>
		<compositor>
			<nombre>Pharrell</nombre>
			<apellido>Williams</apellido>
		</compositor>
	</compositores>
	<productores>
		<productor>
			<nombre>Pharrell</nombre>
			<apellido>Pharrell</apellido>			
		</productor>
	</productores>
	<sello>Warner Bros Records</sello>
	<artista>Madonna</artista>

</cancion>
</canciones>